














"CE"," ","KTAM","KTAM","รีเจนท์โกลด์พร็อพเพอร์ตี้ฟันด์","Regent Gold Property Fund","RGPF",20750080930.01,25.3412,,,,
"CE"," ","KTAM","KTAM","กองทุนรวมสิทธิการเช่าอสังหาริมทรัพย์ ซี.พี.ทาวเวอร์ โกรท","C.P. TOWER GROWTH LEASEHOLD PROPERTY FUND","CPTGF",10051193592.47,10.3942,0.2037000000000,31/08/2018,,
"CE"," ","KTAM","KTAM","กองทุนรวมสิทธิการเช่าอสังหาริมทรัพย์ตลาดไท","Talaad Thai Leashold Property Fund","TTLPF",1916514878.47,10.6473,0.4085000000000,31/08/2018,,
"CE"," ","KTAM","KTAM","กองทุนรวมอสังหาริมทรัพย์และสิทธิเรียกร้องเอเวอร์กรีนแลนด์","Evergreen Land Property and Loan Fund","ELPLF",3444536265.70,26.7225,,,,
"CE"," ","KTAM","KTAM","กองทุนรวมอสังหาริมทรัพย์และสิทธิเรียกร้องอิมพีเรียลเวลธ์","Imperial Wealth Property and Loan Fund","IWPLF",13481060806.30,23.2512,,,,
"CE"," ","KTAM","KTAM","กองทุนรวมอสังหาริมทรัพย์และสิทธิการเช่าเทสโก้ โลตัส รีเทล โกรท","Tesco Lotus Retail Growth Freehold and Leasehold Property Fund","TLGF",26482343132.42,11.3304,0.2303000000000,31/07/2018,,
"CE"," ","KTAM","KTAM","กองทุนรวมอสังหาริมทรัพย์และสิทธิการเช่าอสังหาริมทรัพย์ดุสิตธานี","Dusit Thani Freehold and Leasehold Property Fund","DTCPF",4369579375.24,10.6731,,06/12/2017,,
"CE"," ","KTAM","KTAM","กองทุนรวมธุรกิจไทย 4","The Thai Business Fund 4","TBF4",9595542734.56,9.4091,0.0333000000000,30/04/2008,9.7921,9.7920
"CE"," ","KTAM","KTAM","กองทุนรวมธุรกิจไทย 5","Thai Business Property Fund 5","TBF5",725424260.78,3.2973,0.0944000000000,30/04/2008,7.3766,7.3765
"CE"," ","KSAM","KSAM","กองทุนรวมอสังหาริมทรัพย์ศาลาแอทสาทร","Sala @ Sathorn Property Fund","SSPF",1901895774.88,11.3886,0.4563000000000,11/09/2018,,
"CE"," ","ONEAM","ONEAM","โครงการจัดการกองทุนรวมไทยเรียล เอสเตท รีสตรัคเจอริ่ง 1","Thai Real Estate Restructuring Fund 1","TRRF1",1838333652.94,19.1493,0.0355000000000,31/08/2018,19.1494,19.1493
"CE"," ","ONEAM","ONEAM","กองทุนรวมอสังหาริมทรัพย์ ไทยแลนด์ โฮสพีทาลิตี้","THAILAND HOSPITALITY PROPERTY FUND","TLHPF",1791566870.54,10.4160,0.3650000000000,28/08/2018,10.4161,10.4160
"CE"," ","ONEAM","ONEAM","กองทุนรวมอสังหาริมทรัพย์มิลเลียนแนร์","MILLIONAIRE PROPERTY FUND","MIPF",2453997995.89,12.9157,0.5500000000000,28/08/2018,12.9158,12.9157
"CE"," ","ONEAM","ONEAM","กองทุนรวมอสังหาริมทรัพย์ไทยอินดัสเตรียล 1","Thai Industrial Fund","TIF1",956145595.95,10.6238,0.1340000000000,28/08/2018,10.6239,10.6238
"CE"," ","ONEAM","ONEAM","กองทุนรวมอสังหาริมทรัพย์บางกอก","BANGKOK COMMERCIAL PROPERTY FUND","BKKCP",1254213796.91,12.5421,0.2000000000000,28/08/2018,12.5422,12.5421
"CE"," ","TMBAM","TMBAM","กองทุนรวมอสังหาริมทรัพย์ลักซ์ชัวรี่","Luxury Real Estate Investment Fund","LUXF",2363249915.98,12.0267,0.4300000000000,12/09/2018,,
"CE"," ","UOBAMTH","UOBAMTH","สิทธิการเช่าอสังหาริมทรัพย์ ที ยู โดม เรสซิเดนท์เชียล คอมเพล็กซ์","T.U. Dome Residential Complex Leasehold Property Fund","TU-PF",221302812.75,2.1232,0.1000000000000,30/11/2011,,
"CE"," ","UOBAMTH","UOBAMTH","กองทุนรวมสิทธิการเช่าอสังหาริมทรัพย์ควอลิตี้ ออสพิทอลลิตี้","Quality Hospitality Leasehold Property Fund","QHOP",1548577987.55,8.0950,0.2000000000000,30/11/2011,,
"CE"," ","UOBAMTH","UOBAMTH","กองทุนรวมอสังหาริมทรัพย์และสิทธิ เรียกร้องเอ็นรีช","Enrich Property and Loan Fund","ENRICH",1056984372.13,10.5698,8.5000000000000,31/05/2010,,
"OE"," ","ABERDEEN","ABERDEEN","กองทุนเปิด อเบอร์ดีน สแตนดาร์ด แวลู","Aberdeen Standard Value Fund","ABV",634986491.02,35.2922,,,35.4688,35.2040
"OE"," ","ABERDEEN","ABERDEEN","กองทุนเปิด อเบอร์ดีน สแตนดาร์ด เอเชีย แปซิฟิค เอคควิตี้ เพื่อการเลี้ยงชีพ","Aberdeen Standard Asia Pacific Equity Retirement Mutual Fund","ABAPAC-RMF",327229388.81,12.5036,,,12.5037,12.5036
"OE"," ","ABERDEEN","ABERDEEN","กองทุนเปิด อเบอร์ดีน สแตนดาร์ด เอเชีย แปซิฟิค เอคควิตี้ ฟันด์","Aberdeen Standard Asia Pacific Equity Fund","ABAPAC",1152130886.87,17.6329,,,17.8975,17.6329
"OE"," ","ABERDEEN","ABERDEEN","กองทุนเปิด อเบอร์ดีน สแตนดาร์ด ยูโร ไฮ ยิลด์ บอนด์ ฟันด์","Aberdeen Standard Euro High Yield Bond Fund","ABEHB",153779513.30,12.0821,,,12.2030,12.0821
"OE"," ","ABERDEEN","ABERDEEN","กองทุนเปิด อเบอร์ดีน สแตนดาร์ด ยูโรเปี้ยน โกรท ฟันด์","Aberdeen Standard European Growth Fund","ABEG",255070903.51,8.4931,,,8.6206,8.4931
"OE"," ","ABERDEEN","ABERDEEN","กองทุนเปิด อเบอร์ดีน สแตนดาร์ด โกรท","Aberdeen Standard Growth Fund","ABG",12724114040.40,125.8369,,,125.8370,124.5785
"OE"," ","ABERDEEN","ABERDEEN","กองทุนเปิด อเบอร์ดีน สแตนดาร์ด โกลบอล อีเมอร์จิ้ง โกรท ฟันด์","Aberdeen Standard Global Emerging Growth Fund","ABGEM",601900363.40,12.5413,,,12.7295,12.5413
"OE"," ","ABERDEEN","ABERDEEN","กองทุนเปิด อเบอร์ดีน สแตนดาร์ด แคช ครีเอชั่น","Aberdeen Standard Cash Creation Fund","ABCC",1507970796.60,17.7016,,,17.7017,17.7016
"OE"," ","ABERDEEN","ABERDEEN","กองทุนเปิด อเบอร์ดีน สแตนดาร์ด เจแปน ออพพอร์ทูนิตี้ส์ ฟันด์","Aberdeen Standard  Japan Opportunities Fund","ABJO",376717825.19,12.6470,,,12.8368,12.6470
"OE"," ","ABERDEEN","ABERDEEN","กองทุนเปิด อเบอร์ดีน สแตนดาร์ด เฟล็กซิเบิ้ลแคปปิตอล","Aberdeen Standard Flexible Capital Fund","ABFC",335812683.78,7.8464,0.1500000000000,05/10/2018,7.8661,7.8268
"OE"," ","ABERDEEN","ABERDEEN","กองทุนเปิด อเบอร์ดีน สแตนดาร์ด สมอลแค็พ","Aberdeen Standard Small Cap Fund","ABSM",6537717656.44,50.2115,,,,50.2115
"OE"," ","ABERDEEN","ABERDEEN","กองทุนเปิด อเบอร์ดีน สแตนดาร์ด สมาร์ทแคปปิตอลเพื่อการเลี้ยงชีพ","Aberdeen Standard Smart Capital Retirement Mutual Fund","ABSC-RMF",5208384443.52,95.0097,,,95.0098,95.0097
"OE"," ","ABERDEEN","ABERDEEN","กองทุนเปิด อเบอร์ดีน สแตนดาร์ด สมาร์ทอินคัมเพื่อการเลี้ยงชีพ","Aberdeen Standard Smart Income Retirement Mutual Fund","ABSI-RMF",448873880.52,12.4408,,,12.4409,12.4408
"OE"," ","ABERDEEN","ABERDEEN","กองทุนเปิด อเบอร์ดีน สแตนดาร์ด สยามลีดเดอร์ส","Aberdeen Standard Siam Leaders Fund","ABSL",1348656712.99,48.4580,,,48.7004,48.3369
"OE"," ","ABERDEEN","ABERDEEN","กองทุนเปิด อเบอร์ดีน สแตนดาร์ด หุ้นระยะยาว 70/30","Aberdeen Standard Long Term Equity Fund 70/30","ABLTF 70/30",405437655.99,11.0047,,,11.0048,10.9772
"OE"," ","ABERDEEN","ABERDEEN","กองทุนเปิด อเบอร์ดีน สแตนดาร์ด อเมริกัน โกรท - สมอลเลอร์ คอมพานี ฟันด์","Aberdeen Standard American Growth  Smaller Companies Fund","ABAGS",587791097.94,11.8364,,,12.0140,11.8364
"OE"," ","ABERDEEN","ABERDEEN","กองทุนเปิด อเบอร์ดีน สแตนดาร์ด อเมริกัน โกรท ฟันด์","Aberdeen Standard American Growth Fund","ABAG",138611628.49,21.8282,,,22.1557,21.8282
"OE"," ","ABERDEEN","ABERDEEN","กองทุนเปิด อเบอร์ดีน สแตนดาร์ด อีเมอร์จิ้ง ออพพอร์ทูนิตี้ส์ บอนด์ ฟันด์","Aberdeen Standard Emerging Opportunities Bond Fund","AEOB",339113410.11,16.3651,,,16.5289,16.3651
"OE"," ","ABERDEEN","ABERDEEN","กองทุนเปิด อเบอร์ดีน สแตนดาร์ด อินเดีย โกรท ฟันด์","Aberdeen Standard India Growth Fund","ABIG",555002157.44,14.9490,,,15.1733,14.9490
"OE"," ","ABERDEEN","ABERDEEN","กองทุนเปิด อเบอร์ดีน สแตนดาร์ด อินคัม ครีเอชั่น","Aberdeen Standard Income Creation","ABINC",293897200.99,11.1877,,,11.1878,11.1877
"OE"," ","ABERDEEN","ABERDEEN","กองทุนเปิด อเบอร์ดีน สแตนดาร์ด ไทย เอคควิตี้ ดีวิเด็น","Aberdeen Standard Thai Equity Dividend Fund","ABTED",188574874.06,6.4419,0.1600000000000,16/03/2018,6.5064,6.4419
"OE"," ","ASSETFUND","ASSETFUND","กองทุนเปิด แอสเซท พลัส ตราสารหนี้","ASSET PLUS FIXED INCOME FUND","ASP",2341456497.84,16.4752,,,16.4753,16.4752
"OE"," ","ASSETFUND","ASSETFUND","กองทุนเปิด แอสเซทพลัส โรโบติกส์","Asset Plus Robotics Fund","ASP-ROBOT",1928803201.88,9.5149,,,9.6339,9.5149
"OE"," ","ASSETFUND","ASSETFUND","กองทุนเปิด แอสเซทพลัส เวียดนาม โกรท ฟันด์","Asset Plus Vietnam Growth Fund","ASP-VIET",2636618268.94,8.0434,,,8.1642,8.0434
"OE"," ","ASSETFUND","ASSETFUND","กองทุนเปิด แอสเซทพลัส เฟล็กซิเบิ้ล พลัส","Asset Plus Flexible Plus Fund","ASP-FLEXPLUS",679992168.22,9.8812,,,9.9801,9.8812
"OE"," ","ASSETFUND","ASSETFUND","กองทุนเปิด แอสเซทพลัส สมอล แอนด์ มิด แคป อิควิตี้","Asset Plus Small and Mid Cap Equity Fund","ASP-SME",837867003.11,10.5675,,,10.6733,10.5675
"OE"," ","ASSETFUND","ASSETFUND","กองทุนเปิด แอสเซทพลัส สมอล แอนด์ มิด แคป อิควิตี้ หุ้นระยะยาว","Asset Plus Small and Mid Cap Equity LTF Fund","ASP-SMELTF",88556660.50,8.9662,,,8.9663,8.9662
"OE"," ","ASSETFUND","ASSETFUND","กองทุนเปิด แอสเซทพลัส ตราสารหนี้ เดลี่ พลัส ห้ามขายผู้ลงทุนรายย่อย","Asset Plus Fixed Income Daily Plus Fund Not for Retail Investors","ASP-DPLUS",9750509459.17,10.3196,,,10.3197,10.3196
"OE"," ","ASSETFUND","ASSETFUND","กองทุนเปิดแอสเซทพลัส Strategic","Asset Plus Strategic Investment Fund","ASP-STRATEGIC",79641232.01,8.4532,,,8.4744,8.4321
"OE"," ","ASSETFUND","ASSETFUND","กองทุนเปิดแอสเซทพลัสเอเชี่ยนสเปเชียลซิททูเอชั่นส์","Asset Plus Asian Special Situations Fund","ASP-ASIAN",276129174.37,10.9314,,,11.0955,10.9314
"OE"," ","ASSETFUND","ASSETFUND","กองทุนเปิดแอสเซทพลัสเอสแอนด์พี 500","Asset Plus S&P 500 Fund","ASP-S&P500",304817078.34,30.7385,,,30.8154,30.7385
"OE"," ","ASSETFUND","ASSETFUND","กองทุนเปิดแอสเซทพลัสเอไอเทิร์มฟันด์ 3Y3","Asset Plus AI Term Fund 3Y3","ASP-AITF3Y3",912881980.14,11.0078,,,,
"OE"," ","ASSETFUND","ASSETFUND","กองทุนเปิดแอสเซทพลัสเอไอเทิร์มฟันด์ 5Y1","Asset Plus AI Term Fund 5Y1","ASP-AITF5Y1",407684901.93,11.4853,,,,
"OE"," ","ASSETFUND","ASSETFUND","กองทุนเปิดแอสเซทพลัสเอไอตราสารหนี้ 1 ห้ามขายผู้ลงทุนรายย่อย","Asset Plus AI Fixed Income Fund 1 Not for Retail Investors","ASP-AIF1",416482770.97,10.5712,,,,
"OE"," ","ASSETFUND","ASSETFUND","กองทุนเปิดแอสเซทพลัสเอชเอสไอ","Asset Plus HSI","ASP-HSI",26271938.76,14.9072,,,14.9446,14.9072
"OE"," ","ASSETFUND","ASSETFUND","กองทุนเปิดแอสเซทพลัสโกลด์","Asset Plus Gold Fund","ASP-GOLD",77560669.30,11.3879,,,11.4165,11.3879
"OE"," ","ASSETFUND","ASSETFUND","กองทุนเปิดแอสเซทพลัสโกลบอลอัลโลเคชั่น","Asset Plus Global Allocation Fund","ASP-GAF",12076936.31,9.9572,,,10.0569,9.9572
"OE"," ","ASSETFUND","ASSETFUND","กองทุนเปิดแอสเซทพลัสยุโรปพร็อพเพอร์ตี้","Asset plus Europe Property Fund","ASP-EUPROP",63433057.39,10.3828,,,10.5386,10.3828
"OE"," ","ASSETFUND","ASSETFUND","กองทุนเปิดแอสเซทพลัสสตาร์ 9","Asset Plus Stars Fund 9","ASP-STARS9",29340638.82,8.8028,,,,8.8028
"OE"," ","ASSETFUND","ASSETFUND","กองทุนเปิดแอสเซทพลัสหุ้นระยะยาว","Asset Plus Long-Term Equity Fund","ASP-LTF",247978477.74,16.5639,,,16.5640,16.5639
"OE"," ","ASSETFUND","ASSETFUND","กองทุนเปิดแอสเซทพลัสหุ้นระยะยาวทวีกำไร","Asset Plus High Growth LTF","ASP-GLTF",208331945.70,23.9510,,,23.9511,23.9510
"OE"," ","ASSETFUND","ASSETFUND","กองทุนเปิดแอสเซทพลัสหุ้นไทย","Asset Plus Thai Equity Fund","ASP-THEQ",107605795.21,11.0926,,,11.2036,11.0926
"OE"," ","ASSETFUND","ASSETFUND","กองทุนเปิดแอสเซทพลัสหุ้นผสมตราสารหนี้เพื่อการเลี้ยงชีพ","Asset Plus Mixed RMF","ASP-MRF",208934546.97,27.4805,,,27.4806,27.4805
"OE"," ","ASSETFUND","ASSETFUND","กองทุนเปิดแอสเซทพลัสออยล์","Asset Plus Oil Fund","ASP-OIL",21780566.14,4.4224,,,4.4336,4.4224
"OE"," ","ASSETFUND","ASSETFUND","กองทุนเปิดแอสเซทพลัสไพร์ม 4","Asset Plus Prime Fund 4","ASP-PRIME4",19118304.18,8.1700,,,,8.1700
"OE"," ","ASSETFUND","ASSETFUND","กองทุนเปิดแอสเซทพลัสกำไรปันผล","Asset Plus Growth Dividend Fund","ASP-GDF",28570589.41,11.1583,,,11.1584,11.1583
"OE"," ","ASSETFUND","ASSETFUND","กองทุนเปิดแอสเซทพลัสตราสารหนี้ 2","Asset Plus Fixed Income Fund 2","ASP2",68644469.05,13.8182,,,13.8183,
"OE"," ","ASSETFUND","ASSETFUND","กองทุนเปิดแอสเซทพลัสตราสารหนี้เพื่อการเลี้ยงชีพ","Asset Plus Fixed RMF","ASP-FRF",45261496.08,14.4682,,,14.4683,14.4682
"OE"," ","ASSETFUND","ASSETFUND","กองทุนเปิดแอสเซทพลัสตราสารหนี้ทวีทรัพย์ 2","Asset Plus Taweesab Fixed Income Fund 2","ASP-TFIXED2",199055176.15,11.9599,,,,
"OE"," ","ASSETFUND","ASSETFUND","กองทุนเปิดแอสเซทพลัสตราสารหนี้ทวีทรัพย์ 3","Asset Plus Taweesab Fixed Income Fund 3","ASP-TFIXED3",357811668.75,11.9955,,,,
"OE"," ","ASSETFUND","ASSETFUND","กองทุนเปิดแอสเซทพลัสตราสารหนี้ทวีทรัพย์ 5","Asset Plus Taweesab Fixed Income Fund  5","ASP-TFIXED5",839222368.23,12.6147,,,,
"OE"," ","ASSETFUND","ASSETFUND","กองทุนเปิดแอสเซทพลัสตราสารหนี้ทวีทรัพย์ 6เดือน1 ห้ามขายผู้ลงทุนรายย่อย","Asset Plus Taweesab Fixed Income Fund  6M1 Not for Retail Investor","ASP-TFIXED 6M1",576297918.95,10.0244,,,,
"OE"," ","ASSETFUND","ASSETFUND","กองทุนเปิดแอสเซทพลัสตราสารหนี้ทวีทรัพย์ 7","Asset Plus Taweesab Fixed Income Fund 7","ASP-TFIXED7",179320630.23,12.7839,,,,
"OE"," ","ASSETFUND","ASSETFUND","กองทุนเปิดแอสเซทพลัสตราสารหนี้ทวีทรัพย์ 9","Asset Plus Taweesab Fixed Income Fund 9","ASP-TFIXED9",152768816.23,11.9298,,,,
"OE"," ","ASSETFUND","ASSETFUND","กองทุนเปิดแอสเซทพลัสตราสารทุนเพื่อการเลี้ยงชีพ","Asset Plus Equity RMF","ASP-ERF",195019732.59,27.5844,,,27.5845,27.5844
"OE"," ","ASSETFUND","ASSETFUND","กองทุนเปิดแอสเซทพลัสนิคเคอิ 225","Asset Plus Nikkei 225 Fund","ASP-NKY225",21830211.35,12.5407,,,12.6349,12.5407
"OE"," ","ASSETFUND","ASSETFUND","กองทุนเปิดแอสเซทพลัสบริค","Asset Plus BRIC Fund","ASP-BRIC",21948473.60,6.2589,,,6.3842,6.2589
"OE"," ","BCAP","BCAP","กองทุนเปิด BCAP Mid Small CG ETF","BCAP Mid Small CG ETF","BMSCG",620724541.36,8.9960,,,,
"OE"," ","BCAP","BCAP","กองทุนเปิด BCAP MSCI THAILAND ETF","BCAP MSCI THAILAND ETF","BMSCITH",1275877042.06,12.5086,0.6000000000000,31/07/2018,,
"OE"," ","BCAP","BCAP","กองทุนเปิด BCAP SET100 ETF","BCAP SET100 ETF","BSET100",908504754.95,10.8155,,,,
"OE"," ","BBLAM","BBLAM","กองทุนรวมคนไทยใจดี","BKIND FUND","BKIND",705567146.44,10.6552,,,10.6553,10.5487
"OE"," ","BBLAM","BBLAM","กองทุนรวมบัวหลวงโกลบอลฟิกซ์อินคัม","Bualuang Global Fixed Income Fund","BGFI",4130631133.84,12.6684,,,,
"OE"," ","BBLAM","BBLAM","กองทุนรวมบัวหลวงหุ้นธรรมาภิบาลไทย","Bualuang Thai Equity CG Fund","B-THAICG",501590084.20,9.6913,,,9.6914,9.5944
"OE"," ","BBLAM","BBLAM","กองทุนรวมบัวหลวงธนสารพลัส 10/18","Bualuang Thanasarn Plus 10/18","BP10/18",2641526788.37,10.0606,,,,
"OE"," ","BBLAM","BBLAM","กองทุนรวมบัวหลวงธนสารพลัส 11/18","Bualuang Thanasarn Plus 11/18","BP11/18",1098259324.88,10.0587,,,,
"OE"," ","BBLAM","BBLAM","กองทุนรวมบัวหลวงธนสารพลัส 12/18","Bualuang Thanasarn Plus 12/18","BP12/18",1905244352.59,10.0644,,,,
"OE"," ","BBLAM","BBLAM","กองทุนรวมบัวหลวงธนสารพลัส 13/18","Bualuang Thanasarn Plus 13/18","BP13/18",4129203440.24,10.0661,,,,
"OE"," ","BBLAM","BBLAM","กองทุนรวมบัวหลวงธนสารพลัส 14/18","Bualuang Thanasarn Plus 14/18","BP14/18",3554926494.09,10.0580,,,,
"OE"," ","BBLAM","BBLAM","กองทุนรวมบัวหลวงธนสารพลัส 15/18","Bualuang Thanasarn Plus 15/18","BP15/18",1739489561.36,10.0498,,,,
"OE"," ","BBLAM","BBLAM","กองทุนรวมบัวหลวงธนสารพลัส 16/18","Bualuang Thanasarn Plus 16/18","BP16/18",5941065673.58,10.0462,,,,
"OE"," ","BBLAM","BBLAM","กองทุนรวมบัวหลวงธนสารพลัส 17/18","Bualuang Thanasarn Plus 17/18","BP17/18",3129318715.89,10.0411,,,,
"OE"," ","BBLAM","BBLAM","กองทุนรวมบัวหลวงธนสารพลัส 18/18","Bualuang Thanasarn Plus 18/18","BP18/18",2780273328.35,10.0409,,,,
"OE"," ","BBLAM","BBLAM","กองทุนรวมบัวหลวงธนสารพลัส 19/18","Bualuang Thanasarn Plus 19/18","BP19/18",2688115267.96,10.0438,,,,
"OE"," ","BBLAM","BBLAM","กองทุนรวมบัวหลวงธนสารพลัส 20/18","Bualuang Thanasarn Plus 20/18","BP20/18",4213897192.17,10.0395,,,,
"OE"," ","BBLAM","BBLAM","กองทุนรวมบัวหลวงธนสารพลัส 21/18","Bualuang Thanasarn Plus 21/18","BP21/18",1775928098.96,10.0364,,,,
"OE"," ","BBLAM","BBLAM","กองทุนรวมบัวหลวงธนสารพลัส 22/18","Bualuang Thanasarn Plus 22/18","BP22/18",8611375786.74,10.0369,,,,
"OE"," ","BBLAM","BBLAM","กองทุนรวมบัวหลวงธนสารพลัส 23/18","Bualuang Thanasarn Plus 23/18","BP23/18",5366836775.93,10.0333,,,,
"OE"," ","BBLAM","BBLAM","กองทุนรวมบัวหลวงธนสารพลัส 24/18","Bualuang Thanasarn Plus 24/18","BP24/18",5331896782.02,10.0315,,,,
"OE"," ","BBLAM","BBLAM","กองทุนรวมบัวหลวงธนสารพลัส 25/18","Bualuang Thanasarn Plus 25/18","BP25/18",5011922469.57,10.0244,,,,
"OE"," ","BBLAM","BBLAM","กองทุนรวมบัวหลวงธนสารพลัส 26/18","Bualuang Thanasarn Plus 26/18","BP26/18",1573866122.03,10.0215,,,,
"OE"," ","BBLAM","BBLAM","กองทุนรวมบัวหลวงธนสารพลัส 27/18","Bualuang Thanasarn Plus 27/18","BP27/18",7199366824.77,10.0207,,,,
"OE"," ","BBLAM","BBLAM","กองทุนรวมบัวหลวงธนสารพลัส 28/18","Bualuang Thanasarn Plus 28/18","BP28/18",3719570048.94,10.0200,,,,
"OE"," ","BBLAM","BBLAM","กองทุนรวมบัวหลวงธนสารพลัส 29/18","Bualuang Thanasarn Plus 29/18","BP29/18",2749314569.15,10.0162,,,,
"OE"," ","BBLAM","BBLAM","กองทุนรวมบัวหลวงธนสารพลัส 30/18","Bualuang Thanasarn Plus 30/18","BP30/18",2850824918.11,10.0119,,,,
"OE"," ","BBLAM","BBLAM","กองทุนรวมบัวหลวงธนสารพลัส 31/18","Bualuang Thanasarn Plus 31/18","BP31/18",3368939924.55,10.0062,,,,
"OE"," ","BBLAM","BBLAM","กองทุนรวมบัวหลวงธนสารพลัส 32/18","Bualuang Thanasarn Plus 32/18","BP32/18",2383638142.15,10.0012,,,,
"OE"," ","BBLAM","BBLAM","กองทุนรวมบัวหลวงธนสารพลัส 33/18","Bualuang Thanasarn Plus 33/18","BP33/18",708770279.34,10.0008,,,,
"OE"," ","BBLAM","BBLAM","กองทุนเปิดบัวแก้ว","Buakaew Open-end Fund","BKA",10074227955.97,43.5214,,,43.5215,43.0862
"OE"," ","BBLAM","BBLAM","กองทุนเปิดบัวแก้ว 2","Buakaew 2 Open-end Fund","BKA2",1059314742.20,36.4504,,,36.4505,36.0859
"OE"," ","BBLAM","BBLAM","กองทุนเปิดบัวแก้วปันผล","Buakaew Income Fund","BKD",5106915089.56,4.1294,,,4.1295,4.0882
"OE"," ","BBLAM","BBLAM","กองทุนเปิดบัวหลวง Small-Mid Cap เพื่อการเลี้ยงชีพ","Bualuang Small-Mid Cap RMF","B-SM-RMF",1466037502.88,12.7219,,,12.7220,12.7219
"OE"," ","BBLAM","BBLAM","กองทุนเปิดบัวหลวงร่วมทุน","BUALUNG CAPITAL OPEN-END FUND","BCAP",1497861276.09,3.6204,,,3.6205,3.6204
"OE"," ","BBLAM","BBLAM","กองทุนเปิดบัวหลวงมันนี่มาร์เก็ตเพื่อการเลี้ยงชีพ","Bualuang Money Market RMF","MM-RMF",1848792455.01,11.4702,,,11.4703,11.4702
"OE"," ","BBLAM","BBLAM","กองทุนเปิดบัวหลวงภารตะ","Bualuang Bharata Fund","B-BHARATA",1422510376.02,8.0095,,,8.0897,8.0095
"OE"," ","BBLAM","BBLAM","กองทุนเปิดบัวหลวงโกลด์เพื่อการเลี้ยงชีพ","Bualuang Gold RMF","BGOLDRMF",1062690427.37,9.2361,,,9.2362,9.2361
"OE"," ","BBLAM","BBLAM","กองทุนเปิดบัวหลวงโกลด์ฟันด์","Bualuang Gold  Fund","BGOLD",945385173.82,9.4863,,,9.4977,9.4750
